{
  "candidates": [
    {
      "evidence": [
        {
          "detail": "machine/fake-tool/windows/x64 active at generation 1",
          "kind": "binding"
        },
        {
          "detail": "lifecycle=active health=healthy",
          "digest": "sha256:aaaaaaaaaaaaaaaaaaaaaaaaaaaaaaaaaaaaaaaaaaaaaaaaaaaaaaaaaaaaaaaa",
          "kind": "registry",
          "path": "<BASE>\\catalogue\\root\\store\\fake-tool\\fake-tool\\1.0.0\\win-x64\\fake-tool.bin"
        }
      ],
      "health": "healthy",
      "machine_discoverable": true,
      "management": "managed",
      "path": "<BASE>\\catalogue\\root\\store\\fake-tool\\fake-tool\\1.0.0\\win-x64\\fake-tool.bin",
      "source": "registry",
      "usable": true
    }
  ],
  "capability_id": "fake-tool",
  "effective_new_process": true,
  "effective_now": false,
  "evidence": [
    {
      "detail": "capability=fake-tool version=* scope=*",
      "kind": "query"
    },
    {
      "detail": "selection precedence=steward (revision=sp-1, source=file)",
      "kind": "policy"
    },
    {
      "detail": "a new process sees the resolved path, the current process does not; restart the shell",
      "kind": "effective"
    }
  ],
  "executable": "<BASE>\\catalogue\\root\\store\\fake-tool\\fake-tool\\1.0.0\\win-x64\\fake-tool.bin",
  "found": true,
  "health": "healthy",
  "instance_id": "fake-tool/fake-tool/1.0.0/win-x64",
  "launcher": null,
  "management": "managed",
  "reason_code": "CURRENT_PROCESS_ENV_OLD",
  "schema_version": 1,
  "scope": "machine",
  "selection_reason": "MACHINE_MANAGED_HEALTHY",
  "source": "registry",
  "usable": true,
  "version": "1.0.0",
  "zone": "R"
}
